Release 2
1)
sqlite> SELECT * FROM cars;
id          make        year        used        brand_id  
----------  ----------  ----------  ----------  ----------
1           Sonata      2011        true        1         
2           Sante Fe    2016        false       1         
3           F-150       2016        false       2         
4           330x        2014        true        3         
5           Focus       2010        true        2         
6           M3          2017        false       3    


2) 
sqlite> UPDATE cars SET used = CASE WHEN year != 2017 THEN "true" ELSE "false" END;
sqlite> SELECT * FROM cars;
id          make        year        used        brand_id  
----------  ----------  ----------  ----------  ----------
1           Sonata      2011        true        1         
2           Sante Fe    2016        true        1         
3           F-150       2016        true        2         
4           330x        2014        true        3         
5           Focus       2010        true        2         
6           M3          2017        false       3         


3) 
sqlite> SELECT * FROM cars, brands WHERE cars.brand_id = brands.id;
id          make        year        used        brand_id    id          name      
----------  ----------  ----------  ----------  ----------  ----------  ----------
1           Sonata      2011        true        1           1           Hyundai   
2           Sante Fe    2016        true        1           1           Hyundai   
3           F-150       2016        true        2           2           Ford      
4           330x        2014        true        3           3           BMW       
5           Focus       2010        true        2           2           Ford      
6           M3          2017        false       3           3           BMW  


4)
sqlite> SELECT cars.make, cars.year, cars.used, brands.name FROM cars JOIN brands ON cars.brand_id = brands.id;
make        year        used        name      
----------  ----------  ----------  ----------
Sonata      2011        true        Hyundai   
Sante Fe    2016        true        Hyundai   
F-150       2016        true        Ford      
330x        2014        true        BMW       
Focus       2010        true        Ford      
M3          2017        false       BMW   

5)
sqlite> DELETE FROM cars WHERE used = "false";
sqlite> SELECT * FROM cars;
id          make        year        used        brand_id  
----------  ----------  ----------  ----------  ----------
1           Sonata      2011        true        1         
2           Sante Fe    2016        true        1         
3           F-150       2016        true        2         
4           330x        2014        true        3         
5           Focus       2010        true        2 
